,disease,diagnosis lists,manual_label_1,manual label,score,conversations
0,acne,"['Acne', 'Folliculitis', 'Contact Dermatitis', 'Rosacea']",1,1,5,"[""Patient: Hi, doctor. I've been having a really bad rash on my skin lately. It's full of pus-filled pimples and blackheads. My skin has also been scarring a lot."", ""Diagnosis: ['Acne', 'Rosacea', 'Folliculitis', 'Contact Dermatitis']"", ""Doctor: I'm sorry to hear about the discomfort you're experiencing. Let's try to gather some more information to better understand your symptoms.\n\n1. How long have you been experiencing this rash and these skin changes?\n2. Have you noticed any triggers or anything that seems to make the rash worse, such as certain foods, stress, or skincare products?\n3. Do you recall any recent changes in your skincare routine or use of new products?\n4. Have you experienced any other symptoms, such as itching or pain?\n5. Are you currently taking any medications or have a history of any skin conditions?\n\nUnderstanding these details will help me provide a more accurate assessment."", ""Patient: 1. I've been experiencing the rash and skin changes for a few weeks now.\n2. I haven't noticed any specific triggers that make it worse.\n3. I did recently try a new face wash.\n4. Yes, there is some itching.\n5. I do not have more information."", ""Diagnosis: ['Acne', 'Folliculitis', 'Contact Dermatitis', 'Rosacea']"", ""Doctor: Thank you for sharing more details. To better understand your condition, I have a few more questions:\n\n1. Have you ever had similar skin issues in the past, or is this the first time you're experiencing such a rash?\n2. Do you have any allergies, particularly to skincare products or foods?\n3. Are you taking any medications, even if they're not related to this issue?\n4. Have you experienced any fever or general unwellness accompanying the rash?\n\nThese questions can help us get closer to understanding what might be causing your symptoms."", ""Patient: 1. I've had some breakouts before, but this is the worst it's been.\n2. I do not know.\n3. I do not know.\n4. No, I haven't experienced any fever or general unwellness."", ""Diagnosis: ['Acne', 'Contact Dermatitis', 'Folliculitis', 'Rosacea']"", ""Doctor: Thank you for providing more details about your symptoms. Based on the information you've shared, let's explore some further questions to get a clearer picture of your condition:\n\n1. Have you noticed the rash spreading to areas other than your face, such as your neck, back, or chest?\n2. Can you describe the texture of your rash? Is your skin more oily, dry, or a combination of both?\n3. Have you noticed any redness or visible blood vessels in the affected areas?\n4. Are you experiencing any flaking or peeling of the skin?\n\nAdditionally, it would be helpful to confirm if you are using any other treatments or remedies, such as over-the-counter acne medications or natural remedies. Understanding this could further assist in your diagnosis."", ""Patient: 1. Yes, the rash has spread to my neck and back. \n2. My skin is more oily, with pus-filled pimples and blackheads.\n3. Yes, there is some redness in the affected areas, but I haven't noticed any visible blood vessels.\n4. Yes, my skin is experiencing some scurrying and peeling.\n\nI am not using any treatments or remedies right now. I do not have more information."", ""Diagnosis: ['Acne', 'Folliculitis', 'Contact Dermatitis', 'Rosacea']"", ""Doctor: Based on the details you've provided, here are four possible conditions that might be causing your symptoms:\n\n1. **Acne**: Characterized by oily skin, pus-filled pimples, blackheads, and scarring. It often spreads to areas like the neck and back.\n\n2. **Folliculitis**: An infection of the hair follicles, leading to red, pus-filled bumps that can occur on the face, neck, and body.\n\n3. **Contact Dermatitis**: An allergic reaction or irritation from a substance, potentially triggered by the new face wash you mentioned.\n\n4. **Rosacea**: Though less likely due to the absence of visible blood vessels, it can cause redness and pimples.\n\nI recommend consulting a healthcare professional for a thorough examination and appropriate treatment plan. Take care.""]"
1,acne,"['Acne Vulgaris', 'Folliculitis', 'Contact Dermatitis', 'Heat Rash']",1,1,5,"[""Patient: Hello, I've just developed a severe rash on my skin. It's clogged with pus-filled pimples and blackheads, and my skin has also been quite sensitive."", ""Diagnosis: ['Acne Vulgaris', 'Folliculitis', 'Contact Dermatitis', 'Impetigo']"", ""Doctor: Thank you for sharing that information. I understand that you're experiencing a severe rash with pus-filled pimples, blackheads, and skin sensitivity. \n\nTo better understand your condition, could you please answer the following questions? \n\n1. When did you first notice the rash?\n2. Have you been exposed to any new skincare products, detergents, or environmental substances recently?\n3. Is there any itching, pain, or burning sensation associated with the rash?\n4. Do you have any history of skin conditions or allergies?\n5. Are you currently taking any medications?\n\nYour responses will help provide a clearer picture of the situation."", 'Patient: 1. I first noticed the rash a few days ago.\n2. I do not know. \n3. There is some itching and my skin feels sensitive.\n4. I do not have more information.\n5. I am not currently taking any medications.', ""Diagnosis: ['Acne Vulgaris', 'Contact Dermatitis', 'Folliculitis', 'Impetigo']"", 'Doctor: Thank you for providing that information. To get a better understanding of your condition and narrow down the possibilities, I have a few more questions: \n\n1. Have you experienced any fever or signs of infection, such as warmth or redness around the rash?\n2. Do you have any swelling in the affected area?\n3. Have you been in contact with anyone who has had a skin infection or similar symptoms?\n4. Are there any particular times when the symptoms seem to worsen, like after a workout or during certain weather conditions?\n\nYour answers will help in determining the next steps.', 'Patient: 1. I do not have a fever.\n2. There is some swelling around the pimples.\n3. I do not know.\n4. I have noticed the symptoms seem to worsen after a workout.', ""Diagnosis: ['Acne Vulgaris', 'Contact Dermatitis', 'Folliculitis', 'Heat Rash']"", ""Doctor: Thank you for providing more details. Based on the symptoms you've described, here are some further questions to help narrow down the potential causes of your rash:\n\n1. Have you made any recent changes to your diet or hydration habits?\n2. Do you experience excessive sweating during workouts, and if so, does showering immediately afterward help with the symptoms?\n3. Has the rash spread to any other parts of your body since you first noticed it?\n4. Are there particular areas where the rash is more severe, such as the face, back, or arms?\n5. Do you typically wear tight clothing or gear during workouts that might cause friction with your skin?\n\nThese questions will help us better understand your symptoms and guide us in pinpointing the exact issue."", ""Patient: 1. I do not know.\n2. Yes, I do experience excessive sweating, but showering immediately afterward doesn't seem to help.\n3. No, it's mostly on my face, back, and chest.\n4. The rash is more severe on my face and back.\n5. Yes, I usually wear tight clothing during workouts."", ""Diagnosis: ['Acne Vulgaris', 'Folliculitis', 'Contact Dermatitis', 'Heat Rash']"", ""Doctor: Thank you for providing that information. Based on your symptoms and details shared so far, we're considering the possibility of:\n\n1. Acne Vulgaris\n2. Folliculitis\n3. Contact Dermatitis\n4. Heat Rash\n\nIs there any additional information you would like to provide or further questions you have regarding your condition? Your input could help clarify the situation and guide us toward a more accurate assessment."", 'Patient: I do not have more information.', ""Diagnosis: ['Acne Vulgaris', 'Folliculitis', 'Contact Dermatitis', 'Heat Rash']"", ""Doctor: Based on the information you've provided and the symptoms you're experiencing, here are some possible conditions that could be causing your rash:\n\n1. **Acne Vulgaris**: This is a common skin condition that occurs when hair follicles become clogged with oil and dead skin cells, often resulting in pimples, blackheads, and pimples filled with pus.\n\n2. **Folliculitis**: This condition involves inflammation or infection of the hair follicles, leading to red, bumpy skin, which can also become pus-filled.\n\n3. **Contact Dermatitis**: This rash could be a result of skin irritation from exposure to allergens or irritants, often leading to red, itchy, and sometimes swollen skin.\n\n4. **Heat Rash**: Often caused by excessive sweating, this rash can occur during hot, humid weather or after workouts, characterized by small, itchy bumps.\n\nI recommend consulting with a healthcare professional who can provide a definitive diagnosis and appropriate treatment plan tailored to your specific condition.""]"
2,allergy,"['Allergic Reaction', 'Contact Dermatitis', 'Angioedema', 'Eczema']",1,1,5,"[""Patient: Hello! I've been experiencing some uncomfortable symptoms. My skin is really itchy and red, and sometimes it even peels. My lips and cheeks also swell up, which is really annoying. At times, I get headaches and my eyes become watery because of the swelling."", ""Diagnosis: ['Allergic Reaction', 'Contact Dermatitis', 'Angioedema', 'Eczema']"", ""Doctor: It sounds like you're dealing with some challenging symptoms that are affecting your skin and causing swelling. Let's explore this further to understand your condition better.\n\n1. Have you noticed any new products or substances that you've come into contact with recently, such as skincare products, laundry detergents, or even foods that could be triggering these symptoms?\n2. Do you have any known allergies or a family history of allergic reactions or skin conditions?\n3. Are you currently taking any medications, either prescribed or over-the-counter, and have there been any changes to these recently?\n4. Have you experienced these symptoms before, or is this the first time you're dealing with them?\n\nYour responses will help in understanding the possible underlying cause of your symptoms."", ""Patient: 1. I haven't noticed any new products or substances that I've come into contact with recently.\n2. I do not know.\n3. I do not know.\n4. I do not know."", ""Diagnosis: ['Allergic Reaction', 'Contact Dermatitis', 'Angioedema', 'Eczema']"", ""Doctor: Thank you for providing more information. Since the symptoms include skin irritation, swelling, and headaches, I would like to ask a few more questions to help narrow down the possible causes:\n\n1. Can you recall if there's a pattern or timing to when these symptoms occur? For example, is it worse during certain times of the day or after certain activities?\n2. Have you noticed any relief or worsening of symptoms when using particular medications, creams, or home remedies?\n3. Do you have any additional symptoms, such as difficulty breathing, chest pain, or gastrointestinal issues, that might be associated with your current symptoms?\n4. To your knowledge, have you had any changes in your environment, like increased exposure to dust, pollen, or pets?\n\nYour answers will help in further assessing the situation. If you have any questions about the symptoms or want to share more details about your medical history or any medications you're taking, please feel free to let me know."", ""Patient: 1. I haven't noticed a specific pattern, but sometimes it feels worse after I've been outside or after eating certain foods.\n2. Some over-the-counter allergy medications help a bit with the swelling and itching, but nothing works completely.\n3. No, I do not have additional symptoms like difficulty breathing, chest pain, or gastrointestinal issues.\n4. I haven't had any significant changes in my environment recently.\n\nI do not have more information."", ""Diagnosis: ['Allergic Reaction', 'Contact Dermatitis', 'Angioedema', 'Eczema']"", ""Doctor: Thank you for sharing this information. Based on your symptoms and the details you've provided, here are a few possible conditions to consider:\n\n1. **Allergic Reaction**: Given that your symptoms can worsen after being outside or after eating certain foods, an allergic reaction might be involved.\n2. **Contact Dermatitis**: Although you haven’t identified any new products, this can occur with repeated exposure to something already in your environment.\n3. **Angioedema**: This involves swelling similar to what you’re experiencing, especially with your lips and cheeks.\n4. **Eczema**: The redness, itching, and peeling can also be indicative of eczema, particularly if there is any history of this in your past or in your family.\n\nIf you have any further questions or concerns, or if you would like to provide more detailed medical history or discuss current medications, please feel free to share."", 'Patient: I do not have more information.', ""Diagnosis: ['Allergic Reaction', 'Contact Dermatitis', 'Angioedema', 'Eczema']"", ""Doctor: Based on the symptoms you've described, here are four possible conditions that might be affecting you:\n\n1. **Allergic Reaction**: Your symptoms could be related to allergies, especially since they worsen after being outside or eating certain foods.\n2. **Contact Dermatitis**: This condition can result from repeated exposure to certain substances, even if no new products have been introduced.\n3. **Angioedema**: The swelling you're experiencing in your lips and cheeks could be indicative of angioedema.\n4. **Eczema**: The redness, itching, and peeling skin may suggest eczema, which sometimes runs in families or can be triggered by environmental factors.\n\nIt's important to consult with a medical professional for a thorough evaluation and diagnosis. They can provide appropriate treatment and further advice tailored to your situation. Take care and don't hesitate to reach out for professional guidance.""]"
3,allergy,"['Allergic Rhinitis', 'Sinusitis', 'Viral Upper Respiratory Infection', 'Angioedema']",1,1,5,"[""Patient: Hello! I have a sore throat and I am sneezing all the time. Sometimes my face swells up, especially my lips and the area around my eyes. I can't stop sneezing once I start."", ""Diagnosis: ['Allergic Rhinitis', 'Sinusitis', 'Viral Upper Respiratory Infection', 'Angioedema']"", ""Doctor: Thank you for providing that information. I'd like to ask a few more questions to better understand your symptoms:\n\n1. Have you experienced any recent exposure to allergens such as pollen, pet dander, or dust?\n2. Do you have a history of allergies or asthma?\n3. Are you currently taking any medications, including over-the-counter drugs or herbal supplements?\n4. Have you noticed any other symptoms, such as a fever, cough, or changes in your voice?\n\nYour responses will help in narrowing down the possible causes of your symptoms."", 'Patient: 1. I do not know.\n2. I do not know.\n3. I do not have more information.\n4. I do not know.', ""Diagnosis: ['Allergic Rhinitis', 'Sinusitis', 'Viral Upper Respiratory Infection', 'Angioedema']"", ""Doctor: Thank you for your responses. Since the information isn't fully clear, let's try to pinpoint more details. Could you please provide answers to the following questions?\n\n1. How long have you been experiencing these symptoms?\n2. Have you noticed any particular triggers or times when your symptoms get worse?\n3. Do you recall any recent illnesses or infections prior to the onset of these symptoms?\n4. Do you have any known food or medication allergies? \n\nGathering additional information will help clarify the situation."", ""Patient: 1. I've been experiencing these symptoms for a few weeks now.\n2. My symptoms seem to get worse when I'm outside or around dust.\n3. I do not recall any recent illnesses or infections.\n4. I do not know if I have any food or medication allergies."", ""Diagnosis: ['Allergic Rhinitis', 'Sinusitis', 'Viral Upper Respiratory Infection', 'Angioedema']"", ""Doctor: Thank you for providing that additional information. Let's try to gather more details to better understand your situation:\n\n1. Have you ever experienced these symptoms before, or is this the first time?\n2. Do you experience any relief from the symptoms when you are indoors away from potential allergens?\n3. Have you taken any treatments or medications for these symptoms, and if so, did they provide any relief?\n4. Do you have any history of similar symptoms in your family, such as allergies or respiratory issues?\n\nYour answers will further assist in identifying the potential causes of your symptoms."", ""Patient: 1. Yes, I have experienced these symptoms before.  \n2. Yes, I do experience some relief when I'm indoors.  \n3. I have tried over-the-counter allergy medications, and they provide some relief.  \n4. I do not know.  "", ""Diagnosis: ['Allergic Rhinitis', 'Sinusitis', 'Viral Upper Respiratory Infection', 'Angioedema']"", ""Doctor: Thank you for sharing that information. Since the similarity score is below the threshold, I'll ask a few more questions to clarify or expand on the symptoms:\n\n1. Do you experience nasal congestion or a runny nose along with sneezing and sore throat?\n2. Have you had any changes in the color or texture of your mucus?\n3. Have you noticed if your symptoms are seasonal or occur year-round?\n4. Do you wake up with these symptoms, or do they develop throughout the day?\n\nAdditionally, if you remember any other details about your medical history or medications, it would be helpful. Your responses will help in narrowing down the possible illnesses."", 'Patient: 1. Yes, I do have a runny nose along with sneezing and sore throat.\n2. I do not know.\n3. I think they are more seasonal.\n4. I wake up with these symptoms; they are often worse in the morning.', ""Diagnosis: ['Allergic Rhinitis', 'Sinusitis', 'Viral Upper Respiratory Infection', 'Angioedema']"", ""Doctor: Thank you for the additional details. Based on the information you've shared, here are a few things we can consider:\n\n1. **Allergic Rhinitis:** Given the seasonal nature of your symptoms, relief indoors, and reaction to dust, this could be a likely cause.\n\n2. **Sinusitis:** This might also be a consideration, especially if you're experiencing nasal congestion and sore throat. However, the relief with allergy medications leans more towards allergies.\n\n3. **Viral Upper Respiratory Infection:** Typically, this would involve a fever or recent illness, which you have not experienced, so it's less likely.\n\n4. **Angioedema:** The facial and lip swelling could suggest this, although it would usually involve a known trigger or allergy.\n\nWould you like to provide any more details, or do you have further questions about these possible conditions?"", 'Patient: I do not have more information.', ""Diagnosis: ['Allergic Rhinitis', 'Sinusitis', 'Viral Upper Respiratory Infection', 'Angioedema']"", ""Doctor: Based on the symptoms and information you've provided, here are the possible conditions we can consider:\n\n1. **Allergic Rhinitis:** This is a common cause of sneezing, runny nose, and sore throat, especially when symptoms worsen outdoors or around dust.\n\n2. **Sinusitis:** This condition involves inflammation of the sinuses and can cause nasal congestion and sore throat, but the relief from allergy medications suggests it might be less likely.\n\n3. **Viral Upper Respiratory Infection:** This generally includes symptoms like fever or recent illness, which you have not experienced, making it less probable.\n\n4. **Angioedema:** The swelling of the face and lips could indicate this, although it usually requires a known allergy or trigger.\n\nI recommend consulting with a medical professional for an accurate diagnosis and appropriate treatment. Take care, and feel free to reach out if you have more questions in the future.""]"
4,arthritis,"['Rheumatoid Arthritis', 'Polymyalgia Rheumatica', 'Lupus', 'Fibromyalgia']",1,1,5,"[""Patient: Hello, doctor. I've been feeling really weak in my muscles and my neck has been really stiff. My joints have been swelling up, and it's hard for me to move around without feeling stiff. Walking has been really painful too."", ""Diagnosis: ['Rheumatoid Arthritis', 'Polymyalgia Rheumatica', 'Lupus', 'Fibromyalgia']"", ""Doctor: I'm sorry to hear that you're experiencing these symptoms. To help assess your condition more accurately, I have a few follow-up questions:\n\n1. How long have you been experiencing these symptoms?\n2. Have you noticed any changes in your general health, such as fever, fatigue, or weight loss?\n3. Do you have any other symptoms like a rash, headaches, or numbness?\n4. Have you been diagnosed with any medical conditions in the past or are you taking any medications currently?\n5. Have there been any recent changes in your lifestyle or stress levels?\n\nYour answers will help in better understanding your situation."", ""Patient: 1. I've been experiencing these symptoms for a while now, maybe a few months.  \n2. Yes, I've been feeling quite fatigued lately, but I haven't noticed any fever or weight loss.  \n3. No, I haven't noticed a rash, headaches, or numbness.  \n4. I do not know.  \n5. I do not have more information.  "", ""Diagnosis: ['Rheumatoid Arthritis', 'Polymyalgia Rheumatica', 'Fibromyalgia', 'Lupus']"", ""Doctor: I understand this situation can be concerning for you. Given that the similarity score is below the threshold, let's gather some more information to help narrow down the possibilities.\n\n1. Could you describe more about the stiffness and pain—is it more severe at certain times of the day, such as in the morning?\n2. Have you noticed any patterns or triggers, like certain foods, activities, or weather changes that make your symptoms worse?\n3. Have you had any recent infections or illnesses, and are you up to date with vaccinations?\n4. Considering previous medical conditions, do you have a family history of autoimmune or connective tissue diseases?\n\nYour answers to these questions can provide more clarity about your symptoms."", ""Patient: 1. The stiffness and pain are definitely more severe in the morning. It takes a while for me to get moving.\n2. I haven't noticed any specific patterns or triggers, but being active can make the pain worse.\n3. I have not had any recent infections or illnesses that I know of, and I believe I'm up to date with vaccinations.\n4. I do not know about any family history related to autoimmune or connective tissue diseases."", ""Diagnosis: ['Rheumatoid Arthritis', 'Polymyalgia Rheumatica', 'Fibromyalgia', 'Lupus']"", ""Doctor: Thank you for providing more details. Based on what you've shared, your symptoms of morning stiffness, muscle weakness, joint swelling, and fatigue are consistent with several possible conditions. Here are some potential illnesses that could be considered: \n\n1. **Rheumatoid Arthritis** - This is characterized by joint inflammation and morning stiffness.\n2. **Polymyalgia Rheumatica** - Commonly causes muscle pain and stiffness, especially in the neck, shoulders, and hips.\n3. **Lupus** - An autoimmune condition that can cause widespread joint pain and fatigue.\n4. **Fibromyalgia** - Known for widespread pain and fatigue, often worsening with activity.\n\nWould you like to provide more information, or do you have additional questions? I'm here to help you further."", 'Patient: I do not have more information.', ""Diagnosis: ['Rheumatoid Arthritis', 'Polymyalgia Rheumatica', 'Fibromyalgia', 'Lupus']"", ""Doctor: Based on the symptoms you've described and the information you've provided, the possible conditions to consider include:\n\n1. **Rheumatoid Arthritis** - Often associated with joint inflammation and severe morning stiffness.\n2. **Polymyalgia Rheumatica** - Characterized by muscle pain and stiffness, especially in the neck and shoulders.\n3. **Lupus** - An autoimmune disorder that can cause joint pain and fatigue.\n4. **Fibromyalgia** - Known for causing widespread pain and fatigue, often exacerbated by physical activity.\n\nIf you have no further questions, I recommend reaching out to a healthcare provider for an in-depth evaluation and appropriate testing to confirm any diagnosis. Feel free to reach out anytime if you need further assistance or clarification."", 'Patient: Thank you for the information. I will reach out to a healthcare provider for further evaluation.', ""Diagnosis: ['Rheumatoid Arthritis', 'Polymyalgia Rheumatica', 'Lupus', 'Fibromyalgia']"", ""Doctor: Based on the symptoms you've described—morning stiffness, muscle weakness, joint swelling, and fatigue—the possible conditions to consider include:\n\n1. **Rheumatoid Arthritis**: Often associated with joint inflammation and severe morning stiffness.\n2. **Polymyalgia Rheumatica**: Characterized by muscle pain and stiffness, especially in the neck and shoulders.\n3. **Lupus**: An autoimmune disorder that can cause joint pain and fatigue.\n4. **Fibromyalgia**: Known for causing widespread pain and fatigue, often exacerbated by physical activity.\n\nI recommend consulting with a healthcare provider for further evaluation and appropriate testing to confirm any diagnosis. Take care, and feel free to reach out if you have more questions or need assistance in the future.""]"
