,disease,diagnosis lists,manual_label_1,manual label,score,conversations
14,diabetes,"['Diabetes Mellitus', 'Hypothyroidism', 'Depression', 'Chronic Fatigue Syndrome']",1,1,5,"[""Patient: Hello, doctor. I've been experiencing mood swings and have trouble concentrating. My mind feels hazy and foggy at times, which makes doing even regular chores difficult. I also feel extremely thirsty all the time and have to go to the bathroom a lot."", 'Doctor: Thank you for sharing your symptoms. To help narrow down the possibilities further, could you please let me know if you have experienced any weight changes recently, alterations in sleep patterns, or any changes in your appetite? These details could greatly assist in improving the accuracy of the diagnosis.', 'Patient: I have experienced some changes in my sleep patterns, but I do not have more information about weight changes or appetite.', 'Doctor: Thank you for the additional information. To enhance the accuracy of the diagnosis, could you please describe the changes in your sleep patterns in more detail? Additionally, have you noticed any feelings of fatigue, tingling in the hands or feet, or unexplained irritability?', ""Patient: I've noticed that I feel fatigued quite often, even after getting a full night's sleep. I also experience some unexplained irritability. As for tingling in the hands or feet, I do not have more information."", ""Doctor: Thank you for providing more information. Based on the symptoms you've described, the possibilities include Diabetes Mellitus, Hypothyroidism, Depression, and Chronic Fatigue Syndrome. Could you let me know if you've experienced any changes in your vision or any digestive issues, such as nausea or changes in bowel movements? This information could help narrow down the possibilities even further."", 'Patient: I do not know. I do not have more information.', ""Doctor: Based on the symptoms you've described, the possible illnesses could include Diabetes Mellitus, Hypothyroidism, Depression, and Chronic Fatigue Syndrome. It's important to consult a medical professional who can conduct a thorough examination and provide an accurate diagnosis. Early detection and proper management are crucial for addressing these health concerns. Please schedule an appointment with your healthcare provider to discuss these symptoms further.""]"
15,diabetes,"['Diabetes Mellitus', 'Diabetes Insipidus', 'Hyperthyroidism', ""Sjogren's Syndrome""]",1,1,5,"[""Patient: Hello, doctor. I've been drinking a lot more water and going to the bathroom a lot more often. My mouth and throat are always dry. I've been really hungry and eating a lot more lately."", ""Doctor: It sounds like you're experiencing increased thirst, frequent urination, dry mouth, and an increased appetite. These could be symptoms of several conditions. Could you provide more details about any additional symptoms, such as fatigue, weight changes, or vision issues? This information will help narrow down the possibilities."", ""Patient: I don't have any more information about fatigue, weight changes, or vision issues right now."", ""Doctor: Based on the symptoms you've described, such as increased thirst, frequent urination, dry mouth, and increased appetite, here are some possible illnesses: Diabetes Mellitus, Diabetes Insipidus, Hyperthyroidism, and Sjogren's Syndrome. It's important to understand that these are just possibilities and consulting a medical professional for a thorough examination and accurate diagnosis is vital. Please reach out to a healthcare provider for further evaluation and management.""]"
16,dimorphic hemorrhoids,"['Hemorrhoids', 'Anal Fissure', 'Colorectal Cancer', 'Inflammatory Bowel Disease']",1,1,5,"[""Patient: Hello, doctor. Recently, I've been experiencing constipation and discomfort when having bowel movements. My anus has been quite inflamed, and there's been a lot of blood in my stool. It's also quite painful."", ""Doctor: Thank you for providing this information. To help narrow down the possibilities, could you let me know if you've experienced any other symptoms, such as changes in weight, appetite, or energy levels? Also, do you have any known allergies or chronic conditions?"", 'Patient: I do not have more information.', 'Doctor: Based on your symptoms of constipation, discomfort during bowel movements, anal inflammation, pain, and blood in stool, here are some possible conditions: Hemorrhoids, Anal Fissure, Colorectal Cancer, and Inflammatory Bowel Disease. It is important to consult a medical professional for an accurate diagnosis and appropriate treatment.']"
17,dimorphic hemorrhoids,"['Hemorrhoids', 'Anal fissures', 'Colorectal cancer', 'Inflammatory bowel disease']",1,1,5,"[""Patient: I've been experiencing constipation, pain during bowel movements, and pain in my anus. My stool has been really bloody, and my anus has been really irritated."", 'Doctor: Thank you for providing those details. To help narrow down the possibilities further, could you tell me if you have experienced any additional symptoms such as unexpected weight loss, fatigue, or changes in appetite? Any information about your general health and any medications you might be taking would also be helpful.', 'Patient: I do not know.', 'Doctor: Thank you for sharing that information. Since you are unsure about additional symptoms or changes in your health, it would be helpful to know if you have any other symptoms like fever, nausea, or family history of similar issues. Any further information, such as lifestyle factors or recent diet changes, could assist in refining the possibilities. Please let me know if you have any more details or questions.', 'Patient: I do not have more information.', 'Doctor: Based on your symptoms of constipation, pain during bowel movements, bloody stool, and anal irritation, there are a few potential conditions that could be responsible. These include hemorrhoids, anal fissures, colorectal cancer, and inflammatory bowel disease. It is important to consult with a medical professional who can provide a proper diagnosis and treatment plan. Please make an appointment with a healthcare provider at your earliest convenience.']"
18,fungal infection,"['Contact Dermatitis', 'Psoriasis', 'Eczema', 'Acne']",0,0,0,"[""Patient: I have a rash all over my body. It's itchy and red, and there are some patches that are a different color than the rest of my skin. I also have some pimples that look like little balls."", 'Doctor: Thank you for describing your symptoms. Could you provide more information? Specifically, have you noticed any recent new exposures, such as new skin products, clothing, or environmental changes? Are there any other symptoms such as fever or fatigue?', 'Patient: I do not know. I do not have more information.', ""Doctor: Based on the symptoms you've described, here are some possible conditions: Contact Dermatitis, Psoriasis, Eczema, and Acne. It is important to consult with a medical professional for an accurate diagnosis and appropriate treatment. They can provide further investigation and management tailored to your specific needs.""]"
19,fungal infection,"['Eczema', 'Psoriasis', 'Folliculitis', 'Contact Dermatitis']",0,0,0,"['Patient: I have red spots all over my body, and they are itchy. Some of the spots are a different color than my skin. I also have some lumps or pimples on my skin.', ""Doctor: It sounds like you're experiencing a skin-related issue. Could you tell me if you have a fever, any recent changes in your diet or environment, or if you've applied any new products to your skin recently? This information could help narrow down the possibilities."", ""Patient: I do not have a fever, and there haven't been any recent changes in my diet or environment. I haven't applied any new products to my skin recently either."", ""Doctor: Thank you for providing more details. Since you don't have a fever and haven't made any recent changes that could be causing an allergic reaction, let's explore some other possibilities. Have you traveled recently or worn new clothing that might have come into contact with your skin? Also, please let me know if the spots appeared suddenly or if they have been developing over time."", ""Patient: I haven't traveled recently, and I haven't worn any new clothing. The spots have been developing over time."", 'Doctor: Thank you for the additional information. To further refine the possibilities, could you let me know if the spots are more prominent in specific areas of your body? Also, do you experience any symptoms other than itching, like burning sensations or pain? Your input will be valuable in narrowing down the causes.', ""Patient: The spots are more prominent on my arms and legs, but they are all over my body. Besides the itching, I don't really feel a burning sensation or pain."", ""Doctor: Thank you for sharing this information. It seems like the rash is widespread, with prominence on your arms and legs. Based on the itchiness and development over time without associated burning or pain, it's possible that conditions such as contact dermatitis, psoriasis, eczema, or folliculitis might be causing your symptoms. To help narrow down further, could you let me know if there is any history of skin conditions in your family, or if any lifestyle or environmental factors might provide additional clues? Your feedback will be useful to identify the cause more accurately."", 'Patient: I do not know.', ""Doctor: Based on the symptoms you have described—red, itchy spots all over your body with some lumps and no fever or recent changes in products or environment—the possible conditions could be eczema, psoriasis, folliculitis, and contact dermatitis. These conditions have skin manifestations and itching, but since there's a lack of burning or pain, these are likely possibilities. It's important to consult a healthcare professional for a formal diagnosis and treatment plan. Please see a dermatologist to explore these possibilities further.""]"
20,gastroesophageal reflux disease,"['Gastroesophageal Reflux Disease (GERD)', 'Esophagitis', 'Hiatal Hernia', 'Achalasia']",1,1,5,"[""Patient: I've been having trouble swallowing, and I don't feel like eating. I often feel full, even after just eating a little. I also experience heartburn, nausea, and a tingling sensation in my throat."", ""Doctor: I understand you're experiencing trouble swallowing, a sensation of fullness, heartburn, nausea, and tingling in your throat. Could you provide some more information about the severity and duration of these symptoms, or any other symptoms you may have noticed? This will help in better narrowing down potential causes."", ""Patient: The trouble swallowing and sensation of fullness happen almost every time I eat. I've been having heartburn regularly, especially after meals or when I lie down. The nausea comes and goes, but it's definitely uncomfortable, and the tingling in my throat feels like a burning sensation sometimes. These symptoms have been persistent for a while now, but I don't remember exactly how long. I do not have more information."", ""Doctor: Based on the symptoms you've described, here are some possible illnesses: Gastroesophageal Reflux Disease (GERD), Esophagitis, Hiatal Hernia, and Achalasia. It's important to remember that these are just possibilities, and I recommend consulting a medical professional to obtain a definitive diagnosis and an appropriate treatment plan.""]"
21,gastroesophageal reflux disease,"['Gastroesophageal Reflux Disease (GERD)', 'Esophagitis', 'Achalasia', 'Functional Dyspepsia']",1,1,5,"[""Patient: Hello, doctor. I'm having trouble eating, and it's hard to swallow. I feel full even after eating a small meal. I also have nausea, heartburn, and a tingling sensation in my throat."", ""Doctor: I understand that you're experiencing difficulty swallowing, feeling full quickly, nausea, heartburn, and a tingling sensation in your throat. To help narrow down the possibilities further, could you please provide more details about how long you've been experiencing these symptoms and if there are any other symptoms or triggers you might have noticed?"", ""Patient: I've been experiencing these symptoms for a few weeks now. I do not have more information."", ""Doctor: Based on your symptoms of difficulty swallowing, feeling full quickly, nausea, heartburn, and a tingling sensation in the throat, it's possible that you might be experiencing conditions such as Gastroesophageal Reflux Disease (GERD), Esophagitis, Achalasia, or Functional Dyspepsia. I strongly recommend consulting a medical professional to get an accurate diagnosis and appropriate treatment. Please take care.""]"
22,hypertension,"['Heat Exhaustion', 'Anxiety Attack', 'Cardiovascular Disease', 'Vestibular Disorder']",0,0,0,"[""Patient: Hello, I was in the middle of a workout when I suddenly felt lightheaded and dizzy. I also had a headache and chest pain. Since then, I've been having trouble balancing myself."", ""Doctor: Thank you for sharing those symptoms. To improve the accuracy of the diagnosis, could you tell me if you've experienced any additional symptoms such as nausea, vomiting, sweating, or any recent injuries or illnesses? Also, have these symptoms persisted, worsened, or improved over time?"", ""Patient: I have experienced some sweating, but I haven't noticed any nausea, vomiting, or recent injuries or illnesses. The symptoms have persisted since they started during my workout."", ""Doctor: Thank you for providing further information. Since you've experienced persistent symptoms like lightheadedness, dizziness, headache, chest pain, and sweating, it could be helpful to know if you have any history of heart conditions, anxiety disorders, or have been exposed to extreme temperatures recently. Please share any additional details that could assist in refining the possibilities."", 'Patient: I do not know. I do not have more information.', ""Doctor: Based on the symptoms you've described—lightheadedness, dizziness, headache, chest pain, and sweating—some possible illnesses may include heat exhaustion, an anxiety attack, a cardiovascular issue, or a vestibular disorder. It is important to consult a medical professional for an accurate diagnosis and appropriate treatment. Please take care and seek medical attention promptly if symptoms persist or worsen.""]"
23,hypertension,"['Migraine', 'Anxiety Disorder', 'Hypertension', 'Cardiac-Related Issues']",0,1,2,"[""Patient: Hello, doctor. I've been having a headache and chest pain. I've also been feeling dizzy and unstable. I'm having problems focusing too."", 'Doctor: Thank you for sharing your symptoms. To help narrow down the possibilities, could you tell me more about the duration and intensity of your headache and chest pain? Also, do you have any other symptoms or medical conditions that might be relevant?', ""Patient: I've been having the headache and chest pain for a few days now. The headache is persistent and quite bothersome, and the chest pain comes and goes. I've also been feeling dizzy and unstable, and I'm having problems focusing. I do not have more information."", ""Doctor: Based on the symptoms you've described, here are some possible conditions: Migraine, which can cause headaches and focusing issues; Anxiety Disorder, which may lead to chest pain and dizziness; Hypertension, which can cause both dizziness and headaches; and Cardiac-Related Issues, which might explain the chest pain. It is important to consult a medical professional to get an accurate diagnosis and appropriate treatment. Please take care.""]"
24,impetigo,"['Viral Infection', 'Herpes Simplex Virus', 'Shingles', 'Allergic Reaction']",0,0,0,"[""Patient: Hello, Doctor. I'm having some trouble right now. I have a fever and a headache. I've noticed some sores near my nose and there are rashes on my neck. It's been really uncomfortable."", ""Doctor: I understand that you're experiencing fever, headache, sores near your nose, and rashes on your neck. These symptoms could be indicative of several conditions. Could you tell me if you have any additional symptoms like sensitivity to light, sore throat, or body aches? This information can help narrow down the possibilities."", 'Patient: I do not have more information.', 'Doctor: Based on your symptoms of fever, headache, sores near your nose, and rashes on your neck, there are several possible conditions that could be affecting you, such as a viral infection, herpes simplex virus, shingles, or an allergic reaction. However, these are just possibilities, and I strongly recommend consulting a medical professional for an accurate diagnosis and appropriate treatment. Please take care.']"
25,impetigo,"['Measles', 'Scarlet Fever', 'Fifth Disease', 'Contact Dermatitis']",0,0,0,"[""Patient: Hello, I'm running a fever and I have a rash on my face, neck, and arms. The rash is painful and red. I'm worried about my health."", ""Doctor: It sounds like you're experiencing some uncomfortable symptoms. Could you tell me if you have any other symptoms like a sore throat, headache, or swollen lymph nodes? This information can help narrow down the possibilities."", 'Patient: I do not know. I just know about the fever and the painful, red rash on my face, neck, and arms. I do not have more information.', 'Doctor: Based on your symptoms of fever and a painful, red rash on your face, neck, and arms, here are some possible illnesses: Measles, Scarlet Fever, Fifth Disease, and Contact Dermatitis. It is important to consult a medical professional to receive an accurate diagnosis and appropriate treatment. Please seek medical attention at your earliest convenience.']"
26,jaundice,"['Hepatitis', 'Gallstones', 'Jaundice', 'Pancreatitis']",1,1,5,"[""Patient: Hello, doctor. I've been feeling really sick lately. I've been itching all over, and I've been vomiting. I've also lost a lot of weight, and I have a fever. My skin has turned yellow, and my urine is dark. I've also been having abdominal pain."", ""Doctor: I'm sorry to hear you're experiencing these symptoms. To help narrow down the potential causes, could you tell me if you've noticed any changes in your stools or if you have any history of liver disease or gallbladder issues in your family?"", ""Patient: I don't have any liver disease or gallbladder issues in my family, and I haven't noticed any changes in my stools. I do not have more information."", ""Doctor: Based on the symptoms you've described, such as itching, vomiting, weight loss, fever, jaundice, dark urine, and abdominal pain, there are several possible illnesses to consider, including Hepatitis, Gallstones, Jaundice, and Pancreatitis. It is important to consult a medical professional as soon as possible for a proper diagnosis and treatment plan.""]"
27,jaundice,"['Hepatitis', 'Pancreatitis', 'Gallstones', 'Liver Cirrhosis']",1,1,5,"[""Patient: Hello, Doctor. I've been feeling really sick and tired lately. I've lost some weight and have had a fever. My urine has been dark, and my skin has turned yellow. I've also been experiencing some stomach pain."", ""Doctor: Based on the symptoms described, it could be helpful to know if you've experienced any nausea, changes in your appetite, or if there's any specific timing or pattern to the pain and fever. Any travel history or known exposure to infected individuals could also be relevant. Could you provide more details? This will help narrow down the possibilities."", ""Patient: I've been feeling nauseous, and I've lost my appetite. The stomach pain and fever don't seem to have a specific pattern or timing. I haven't traveled recently, and I don't know of any exposure to infected individuals."", ""Doctor: Based on the symptoms you've described, possible conditions could include Hepatitis, Pancreatitis, Gallstones, and Liver Cirrhosis. I strongly advise you to consult a medical professional for an accurate diagnosis and appropriate treatment. Your symptoms are serious and should be addressed promptly.""]"
28,migraine,"['Migraines', 'Tension Headaches', 'Cervical Spondylosis', 'Cluster Headaches']",1,1,5,"[""Patient: I've been having a lot of headaches lately, and they're getting worse. I also have a sore neck, and I'm feeling anxious and irritated. I've also been having trouble seeing things clearly."", 'Doctor: Thank you for sharing your symptoms. Could you please provide more information about the duration and frequency of your headaches, any recent changes in your lifestyle, or any additional symptoms you might have noticed? This will help in narrowing down the potential causes.', ""Patient: My headaches have been happening a lot lately, and they're getting worse. They last for hours, sometimes most of the day. I also have a sore neck, feel anxious and irritated, and have trouble seeing things clearly. I haven't noticed any specific lifestyle changes lately."", ""Doctor: Based on the symptoms you've described, there are several possibilities regarding the cause of your headaches. To help narrow this down further, I would need more details about your symptoms. For instance, have you experienced any nausea or sensitivity to light and sound, and does the headache start in the neck and spread upwards? Additionally, are there any patterns or triggers you've noticed? Your answers can provide more insight into these symptoms."", ""Patient: I have noticed a sensitivity to light and sound when I have these headaches. The headache often starts in my neck and spreads upwards. I haven't noticed any specific patterns or triggers. I do not know if nausea is part of it."", ""Doctor: Thank you for providing more information. Based on your symptoms, it's possible you're experiencing migraines, especially given the sensitivity to light and sound. Tension headaches could also be a factor, considering the neck pain. Cervical spondylosis might be a concern due to the neck pain and its spread to the head. Cluster headaches are less common but can have similar symptoms. Please let me know if there are any other symptoms you haven't mentioned or if you have specific questions. It would also be beneficial to consult a medical professional for a thorough examination."", 'Patient: I do not have more information.', ""Doctor: Based on the symptoms you've described, here are some possible causes for your condition: Migraines, Tension Headaches, Cervical Spondylosis, and Cluster Headaches. Please keep in mind that this is just a preliminary list, and it's important to consult a medical professional for a thorough examination and accurate diagnosis.""]"
29,migraine,"['Migraines', 'Tension Headaches', 'Gastritis', 'Anxiety Disorder']",1,1,5,"[""Patient: I've been having frequent headaches and blurred vision. I also have a stiff neck, anxiety, irritability, and visual disturbances. On top of that, I've been experiencing some stomach problems like indigestion and acidity."", ""Doctor: Thank you for sharing your symptoms. To improve the accuracy of the diagnosis, could you let me know if you've experienced any other symptoms, such as nausea, vomiting, or changes in appetite? Additionally, have you noticed any particular triggers for your headaches or indigestion?"", 'Patient: I have experienced nausea and a change in appetite. As for triggers, I have noticed that stress and certain foods seem to make my headaches and indigestion worse.', 'Doctor: Thank you for providing more information. Your symptoms could relate to a few different conditions such as migraines, tension headaches, gastritis, or possibly an anxiety disorder. Is there anything else you would like to clarify or add about your symptoms, or any other areas of concern?', 'Patient: I do not have more information.', ""Doctor: Based on the symptoms you've described, including frequent headaches, blurred vision, nausea, changes in appetite, and digestive issues, these could indicate conditions such as migraines, tension headaches, gastritis, or an anxiety disorder. I recommend consulting with a medical professional for a thorough evaluation and appropriate treatment. Take care and prioritize seeking professional advice.""]"
30,peptic ulcer disease,"['Irritable Bowel Syndrome (IBS)', 'Gastritis', 'Peptic Ulcer Disease', 'H. pylori infection']",0,1,2,"[""Patient: I've been experiencing a lot of hunger, and I can't seem to get enough to eat. My stomach hurts and cramps sometimes. After I eat, I get really bad gas and bloating."", ""Doctor: It sounds like you're experiencing some digestive issues. Could you tell me if you've noticed any other symptoms, such as nausea, vomiting, or changes in your bowel movements? Any additional information can help narrow down the possible causes of your symptoms."", 'Patient: I sometimes feel nauseous, but I do not have more information.', ""Doctor: Based on your symptoms, here are a few potential conditions that might be causing your discomfort: Irritable Bowel Syndrome (IBS), Gastritis, Peptic Ulcer Disease, or an H. pylori infection. It's important to consult a medical professional for an accurate diagnosis and appropriate treatment. Please make sure to reach out to a healthcare provider soon. If you have any more questions or need further clarification, feel free to ask.""]"
