,disease,diagnosis lists,manual_label_1,manual label,score,conversations
29,migraine,"['Migraine', 'Tension Headache', 'Cervical Spondylosis', 'Anxiety Disorder']",1,1,5,"[""Patient: I've been having frequent headaches and blurred vision. I also have a stiff neck, anxiety, irritability, and visual disturbances. Additionally, I've been experiencing stomach problems, including indigestion and acidity."", ""Diagnosis: ['Migraine', 'Tension Headache', 'Cervical Spondylosis', 'Gastritis']"", ""Doctor: Based on the symptoms you've shared, it would be helpful to delve deeper into a few aspects to gain a clearer picture. Here are some questions that might assist in refining a possible diagnosis:\n\n1. Can you describe the nature of your headaches? For instance, are they throbbing, sharp, or dull?\n2. How long have you been experiencing these symptoms, and do they occur at specific times?\n3. Have you noticed any triggers that seem to precede these headaches or visual disturbances, like specific foods, bright lights, or stress?\n4. Are you currently taking any medications, including over-the-counter or herbal supplements?\n5. Is there any family history of migraines or other neurological conditions?\n6. Have you noticed any recent changes in your ability to move your neck or shoulders comfortably?\n\nYour responses can guide us further in pinpointing the exact cause and offering suitable advice."", ""Patient: 1. The headaches are mostly throbbing.\n2. I've been experiencing these symptoms for several months, and they don't seem to occur at specific times.\n3. I haven't noticed any specific triggers for the headaches or visual disturbances.\n4. I am not currently taking any medications.\n5. I do not know.\n6. I have noticed stiffness in my neck, but I do not know about changes in movement."", ""Diagnosis: ['Migraine', 'Tension Headache', 'Cervical Spondylosis', 'Gastritis']"", 'Doctor: To gain a better understanding of your condition, here are some additional questions that might help clarify your symptoms:\n\n1. Have you noticed any nausea or vomiting accompanying your headaches?\n2. Do you have any history of gastrointestinal disorders or recent changes in your diet that could affect your stomach symptoms?\n3. Can you describe your lifestyle regarding stress levels, physical activities, and any recent life changes that could contribute to your symptoms?\n4. Have you had any recent infections or illnesses that might have preceded the onset of your neck stiffness or other symptoms?\n\nFeel free to share any additional details you may have, which can further assist in identifying the underlying causes.', 'Patient: 1. Yes, I have noticed some nausea with my headaches, but no vomiting.\n2. No, I do not have a history of gastrointestinal disorders, and I haven’t changed my diet recently.\n3. I have been feeling quite stressed lately, and I haven’t been as active as I usually am.\n4. I do not remember having any recent infections or illnesses before the neck stiffness and other symptoms started.\n\nI do not have more information.', ""Diagnosis: ['Migraine', 'Tension Headache', 'Cervical Spondylosis', 'Anxiety Disorder']"", ""Doctor: Given the information you've shared, here are some possible illnesses that might be related to your symptoms:\n\n1. **Migraine** - The combination of throbbing headaches, nausea, visual disturbances, and anxiety could point towards migraines.\n2. **Tension Headache** - Stress and neck stiffness can contribute to tension headaches, which often present with similar symptoms.\n3. **Cervical Spondylosis** - Your neck stiffness and headaches might be linked to cervical spondylosis, a condition related to wear and tear on the neck.\n4. **Anxiety Disorder** - The irritability and anxiety you experience could be a contributing factor, potentially influencing the frequency and severity of headaches and gastrointestinal symptoms. \n\nIf you have any other questions or details you'd like to discuss, feel free to share them. If not, consider these possible avenues to discuss further with a healthcare provider for a definitive diagnosis and treatment plan."", 'Patient: I do not have more information.', ""Diagnosis: ['Migraine', 'Tension Headache', 'Cervical Spondylosis', 'Anxiety Disorder']"", 'Doctor: Based on your symptoms and the information provided, here are four possible illnesses that might be contributing to your condition:\n\n1. **Migraine** - Characterized by throbbing headaches, nausea, visual disturbances, and potentially linked with anxiety.\n2. **Tension Headache** - Associated with stress and neck stiffness, often presenting with similar symptoms.\n3. **Cervical Spondylosis** - May cause neck stiffness and headaches due to neck wear and tear.\n4. **Anxiety Disorder** - Could influence the frequency and severity of headaches and gastrointestinal symptoms.\n\nIt would be beneficial to consult with a healthcare provider to further explore these possibilities and develop an appropriate treatment plan.']"
30,peptic ulcer disease,"['Gastroesophageal Reflux Disease (GERD)', 'Peptic Ulcer Disease', 'Functional Dyspepsia', 'Irritable Bowel Syndrome']",1,1,4,"[""Patient: Hello doctor. I've been feeling like I have a lot of hunger and I can't seem to get enough to eat. My stomach hurts and cramps sometimes, and after I eat, I get really bad gas and bloating."", ""Diagnosis: ['Irritable Bowel Syndrome', 'Gastroenteritis', 'Lactose Intolerance', 'Celiac Disease']"", ""Doctor: Thank you for sharing your symptoms with me. Let's gather a bit more information to better understand your condition. \n\n1. How long have you been experiencing these symptoms?\n2. Have you noticed if any specific foods trigger your symptoms more than others?\n3. Do you have any other symptoms like nausea, diarrhea, or fever?\n4. Have you been diagnosed with any medical conditions previously or are you currently taking any medications?\n\nYour answers will help narrow down possible causes and guide us towards the right course of action."", ""Patient: 1. I have been experiencing these symptoms for a few weeks.\n2. I haven't noticed any specific foods that trigger my symptoms more than others.\n3. I sometimes feel a bit of nausea, but I do not have diarrhea or fever.\n4. I do not have more information."", ""Diagnosis: ['Irritable Bowel Syndrome', 'Gastroenteritis', 'Lactose Intolerance', 'Peptic Ulcer Disease']"", ""Doctor: Thank you for the additional information. Since your symptoms have been going on for a few weeks and there's some nausea but no diarrhea or fever, let's try to gather a bit more information to better understand your condition:\n\n1. Can you tell me how frequent your symptoms occur? Are they daily or only after certain meals?\n2. Have you experienced any recent stress or changes in your lifestyle that could be related to your symptoms?\n3. Do you drink alcohol or caffeine, and if so, how much?\n4. Have you noticed any changes in your bowel habits, such as frequency or consistency?\n\nAdditionally, if you can recall any other medical history or current medication details, feel free to include that information. Your responses will help in narrowing down the possible conditions further."", ""Patient: 1. My symptoms occur almost daily, and they seem to get worse after I eat.\n2. I do not know.\n3. I do drink coffee regularly, maybe a couple of cups a day. I occasionally have alcohol on weekends.\n4. No, I haven't noticed any changes in my bowel habits.\n\nI do not have more information about my medical history or current medication."", ""Diagnosis: ['Irritable Bowel Syndrome', 'Gastroenteritis', 'Peptic Ulcer Disease', 'Functional Dyspepsia']"", ""Doctor: Thank you for providing more details. Based on the information you’ve shared, your symptoms could be indicative of several conditions, but let's try to gather some additional insight:\n\n1. Have you been experiencing any weight loss or gain recently?\n2. Do you have any history of stomach issues in your family?\n3. Do you experience your symptoms even when you haven't eaten, such as during the night or early morning?\n4. Are there any particular positions or activities that seem to relieve or worsen your symptoms?\n\nThese answers will help further refine the possible conditions we’re considering."", ""Patient: 1. I have not noticed any significant weight loss or gain recently.\n2. I do not know.\n3. Yes, I sometimes feel the symptoms, like stomach pain, even when I haven't eaten, especially during the night or early morning.\n4. Sometimes lying down or bending over seems to make it worse, but I do not have more information."", ""Diagnosis: ['Irritable Bowel Syndrome', 'Peptic Ulcer Disease', 'Gastroesophageal Reflux Disease (GERD)', 'Functional Dyspepsia']"", ""Doctor: Based on the symptoms you're experiencing and the information you've provided, let's explore further to ensure we have a clear picture:\n\n1. Do you have any history of allergies, particularly to foods?\n2. Have you traveled recently, especially to areas where there might be different food standards or hygiene conditions?\n3. Are you experiencing any heartburn or sour taste in your mouth, which could indicate acid reflux?\n4. Have you tried any over-the-counter medications or home remedies for relief, and did they help?\n\nYour responses to these questions can help narrow down the possible causes further."", 'Patient: 1. I do not know.\n2. I have not traveled recently.\n3. Yes, I have heartburn sometimes.\n4. I have tried antacids, and they seem to help a bit.', ""Diagnosis: ['Gastroesophageal Reflux Disease (GERD)', 'Peptic Ulcer Disease', 'Functional Dyspepsia', 'Irritable Bowel Syndrome']"", ""Doctor: To better understand your symptoms and provide a more precise diagnosis, let's gather a bit more information:\n\n1. How long have you been experiencing heartburn, and does it coincide with the other symptoms you're having?\n2. Have you noticed any specific activities, foods, or drinks that seem to trigger your heartburn or make it worse?\n3. Do you have a history of smoking, and if so, how much?\n4. Have you noticed any changes in your symptoms since you began taking the antacids?\n\nPlease provide any additional information you can think of, including any family history of similar symptoms or conditions. Your responses will help in refining the possible conditions further."", 'Patient: 1. I do not have more information.\n2. I do not know.\n3. I do not know.\n4. I do not know.\n\nI do not know about any family history of similar symptoms or conditions.', ""Diagnosis: ['Gastroesophageal Reflux Disease (GERD)', 'Peptic Ulcer Disease', 'Functional Dyspepsia', 'Irritable Bowel Syndrome']"", ""Doctor: Thank you for your patience and the information you've provided. To ensure we cover all bases and offer a thorough assessment, let’s explore a few more areas:\n\n1. Have you recently experienced any stress or anxiety, which can sometimes affect digestion?\n2. Do you chew your food thoroughly and eat at a moderate pace, or do you find yourself eating quickly?\n3. How much sleep are you typically getting each night, and do you feel well-rested when you wake up?\n4. Have your symptoms impacted your daily activities or quality of life significantly?\n\nThese questions can help us get a fuller picture of your situation. Feel free to share any additional thoughts or concerns."", ""Patient: 1. I've been a bit stressed lately, but I'm not sure if it's affecting my digestion.\n2. I do tend to eat quickly, especially when I'm really hungry.\n3. I think I get around 6 to 7 hours of sleep each night, but I often feel tired in the morning.\n4. Yes, the symptoms have been bothering me a lot and making it harder to enjoy my daily activities.\n\nI do not have more information."", ""Diagnosis: ['Gastroesophageal Reflux Disease (GERD)', 'Peptic Ulcer Disease', 'Functional Dyspepsia', 'Irritable Bowel Syndrome']"", ""Doctor: Based on the information you've provided, your symptoms may be related to one or more of the following conditions: \n\n1. **Gastroesophageal Reflux Disease (GERD)** - This can cause heartburn and symptoms that worsen when lying down or after eating.\n2. **Peptic Ulcer Disease** - This may lead to stomach pain and symptoms that occur even when you haven't eaten.\n3. **Functional Dyspepsia** - Often presents with abdominal discomfort or bloating without a clear structural cause.\n4. **Irritable Bowel Syndrome (IBS)** - Can include symptoms like bloating and stomach pain, often related to stress and diet.\n\nI recommend consulting with a healthcare professional who can perform a more comprehensive evaluation and possibly recommend tests to confirm a diagnosis.""]"
31,peptic ulcer disease,"['Gastroesophageal Reflux Disease (GERD)', 'Peptic Ulcer Disease', 'Chronic Gastritis', 'H. Pylori Infection']",1,1,4,"['Patient: I have been losing weight and having trouble gaining it back. I feel pain and discomfort in my stomach, but it gets better when I take antacids. Also, my mouth tastes bad.', ""Diagnosis: ['Gastroesophageal Reflux Disease (GERD)', 'Peptic Ulcer Disease', 'Chronic Gastritis', 'Celiac Disease']"", ""Doctor: I understand you're experiencing weight loss, stomach pain that improves with antacids, and a bad taste in your mouth. To help narrow down the possible causes, could you provide more information on the following:\n\n1. Have you noticed any changes in your bowel movements, such as diarrhea or constipation?\n2. Do you have any known food allergies or a family history of gastrointestinal conditions?\n3. Are you currently taking any medications or supplements, and if so, which ones?\n4. Have you had any recent illnesses or significant changes in your lifestyle or diet?\n\nYour responses will help in providing more accurate insight into your symptoms."", 'Patient: 1. I do not know.\n2. I do not know.\n3. I do not know.\n4. I do not know.', ""Diagnosis: ['Gastroesophageal Reflux Disease (GERD)', 'Peptic Ulcer Disease', 'Chronic Gastritis', 'Celiac Disease']"", 'Doctor: To help us better understand your symptoms and narrow down potential causes, here are a few additional questions:\n\n1. Can you describe the frequency and timing of your stomach pain? Does it occur after eating certain foods or at specific times of the day?\n2. Have you noticed any changes in your appetite or eating habits recently?\n3. Do you smoke or consume alcohol? If so, how frequently?\n4. Have you experienced any nausea or vomiting?\n\nAdditionally, if you happen to recall any details about your medical history, medications, or family history later, please let me know. Any information you can provide is helpful.\n\nOnce you provide more information, I can summarize the possible illnesses for you.', ""Patient: 1. The stomach pain occurs quite often, especially after meals, and sometimes at night. It's usually relieved by taking antacids.\n\n2. I've noticed a decrease in my appetite, and I've been losing weight without trying, which is unusual for me.\n\n3. I do not smoke, but I do consume alcohol occasionally.\n\n4. I haven't experienced nausea or vomiting, but sometimes my mouth tastes bad.\n\nI do not have more information."", ""Diagnosis: ['Gastroesophageal Reflux Disease (GERD)', 'Peptic Ulcer Disease', 'Chronic Gastritis', 'H. Pylori Infection']"", 'Doctor: Thank you for providing more information. Based on your symptoms of frequent stomach pain, especially after meals and at night, weight loss, decreased appetite, and a bad taste in your mouth, here are some possible illnesses:\n\n1. **Gastroesophageal Reflux Disease (GERD)**: This condition is characterized by stomach acid frequently flowing back into the tube connecting your mouth and stomach, causing discomfort. It often improves with antacids.\n\n2. **Peptic Ulcer Disease**: This involves open sores that develop on the inside lining of your stomach or the upper portion of your small intestine. Stomach pain that is relieved by antacids is a common symptom.\n\n3. **Chronic Gastritis**: This is a condition of chronic inflammation of the stomach lining, which can lead to symptoms such as stomach pain and loss of appetite.\n\n4. **H. Pylori Infection**: An infection in the digestive tract with Helicobacter pylori bacteria, which can lead to ulcers and would explain the stomach discomfort and bad taste.\n\nWould you like to provide further information or ask any more questions about these conditions? Your feedback can further guide us to a more specific understanding.', 'Patient: I do not have more information.', ""Diagnosis: ['Gastroesophageal Reflux Disease (GERD)', 'Peptic Ulcer Disease', 'Chronic Gastritis', 'H. Pylori Infection']"", ""Doctor: Based on the information you've provided—experiencing frequent stomach pain, especially after meals and at night, weight loss, decreased appetite, and a bad taste in your mouth—here are some possible illnesses to consider:\n\n1. **Gastroesophageal Reflux Disease (GERD)**: Characterized by frequent acid reflux, it can cause discomfort that improves with antacids.\n\n2. **Peptic Ulcer Disease**: Involves sores on the stomach lining or upper intestine, often with stomach pain relieved by antacids.\n\n3. **Chronic Gastritis**: A condition involving long-term inflammation of the stomach lining, leading to stomach pain and reduced appetite.\n\n4. **H. Pylori Infection**: An infection in the stomach that can cause ulcers and digestive discomfort, as well as a bad taste in the mouth.\n\nPlease consider consulting a healthcare professional for a proper evaluation and diagnosis.""]"
32,pneumonia,"['Pneumonia', 'Pulmonary Embolism', 'Congestive Heart Failure', 'Acute Bronchitis']",1,1,5,"[""Patient: I'm having trouble breathing and I feel really uncomfortable. I'm sweating a lot, and my throat is really sore. My chest hurts, and my heart is beating fast. I'm coughing up a lot of mucus, and it's brown."", ""Diagnosis: ['Pneumonia', 'Acute Bronchitis', 'Chronic Obstructive Pulmonary Disease (COPD)', 'Pulmonary Embolism']"", ""Doctor: I'm sorry to hear about your symptoms; they sound quite distressing. To help understand your condition better, I have a few additional questions:\n\n1. How long have you been experiencing these symptoms?\n2. Do you have any medical history of respiratory issues or heart-related conditions?\n3. Are you a smoker or have you been exposed to any environmental pollutants recently?\n4. Are you currently taking any medications or have any allergies to medications?\n\nYour answers will help in providing a more accurate assessment of your condition."", ""Patient: 1. I've been experiencing these symptoms for a few days now.\n2. I do not have any medical history of respiratory issues or heart-related conditions.\n3. I'm not a smoker, and I haven't been exposed to any environmental pollutants recently.\n4. I'm not currently taking any medications, and I don't have any known allergies to medications."", ""Diagnosis: ['Pneumonia', 'Acute Bronchitis', 'Pulmonary Embolism', 'Chronic Obstructive Pulmonary Disease (COPD)']"", 'Doctor: Thank you for providing that information. Since I need a bit more clarity on your symptoms given the similarity score, I have a few more questions to narrow down the possible causes:\n\n1. Have you had any recent infections, such as the flu or a cold, before these symptoms began?\n2. Are you experiencing any additional symptoms such as fever, chills, or feeling unusually tired?\n3. Have you noticed any changes in your appetite or weight recently?\n4. Do you experience any shortness of breath during specific activities, like climbing stairs or walking short distances?\n\nYour responses will be helpful in further understanding the potential causes of your symptoms.', ""Patient: 1. I do not know.\n2. Yes, I've been having fever, chills, and I'm feeling unusually tired.\n3. I do not know.\n4. Yes, I feel shortness of breath even when doing simple activities like walking short distances."", ""Diagnosis: ['Pneumonia', 'Acute Bronchitis', 'Congestive Heart Failure', 'Pulmonary Embolism']"", ""Doctor: Thank you for the additional details. Given your symptoms of difficulty breathing, fever, chills, fatigue, chest pain, and production of brown mucus, it's important to carefully consider the possible causes. Here are a few more questions to help us further narrow down the diagnosis:\n\n1. Have you experienced a recent cough that has persisted for more than a few days or changed recently?\n2. Have you traveled recently, particularly by plane, or had periods of prolonged immobility?\n3. Do you have any swelling in your legs or abdomen?\n4. Have you noticed any skin color changes, such as paleness or a bluish tint?\n\nThese additional details will help in assessing your condition more accurately."", ""Patient: 1. Yes, I've had a cough that has persisted and changed recently.   \n2. I have not traveled recently or had prolonged immobility.  \n3. I do not have any swelling in my legs or abdomen.  \n4. I haven't noticed any skin color changes."", ""Diagnosis: ['Pneumonia', 'Acute Bronchitis', 'Pulmonary Embolism', 'Congestive Heart Failure']"", ""Doctor: Thank you for your patience and for providing those details. Based on the information you've given, here are a couple more questions to further evaluate your condition:\n\n1. Have you noticed any night sweats or changes in body temperature that occur during sleep?\n2. Are you experiencing any nausea or dizziness in addition to the mentioned symptoms?\n\nYour input will be valuable for narrowing down the health issues you might be facing."", ""Patient: 1. Yes, I've noticed night sweats.\n2. I do not know."", ""Diagnosis: ['Pneumonia', 'Acute Bronchitis', 'Pulmonary Embolism', 'Congestive Heart Failure']"", 'Doctor: Thank you for your detailed responses. Given your symptoms of difficulty breathing, fever, chills, night sweats, fatigue, chest pain, coughing with brown mucus, and shortness of breath during activities, several conditions could be causing these issues. Since I need more information to reach a more accurate assessment, here are some targeted questions:\n\n1. Have you recently experienced unexplained weight loss?\n2. Do you have any family history of respiratory or cardiovascular conditions?\n3. Have you experienced any recent trauma or injuries to the chest area?\n4. Are there any specific times during the day or night when your symptoms worsen?\n\nThis additional information will be helpful to understand your symptoms better. If you have no further questions or comments after this, I can summarize the possible illnesses.', ""Patient: 1. No, I haven't noticed any unexplained weight loss.\n2. I do not know.\n3. No, I haven't had any recent trauma or injuries to my chest.\n4. My symptoms seem to worsen at night."", ""Diagnosis: ['Pneumonia', 'Acute Bronchitis', 'Pulmonary Embolism', 'Congestive Heart Failure']"", ""Doctor: Thank you for your patience and for sharing all this information. Based on the symptoms you've described, such as difficulty breathing, chest pain, fever, chills, night sweats, and coughing with brown mucus, along with your recent answers, we are considering a few potential conditions:\n\n1. **Pneumonia**: An infection of the lungs that can cause fever, chills, chest pain, and coughing up colored mucus. \n\n2. **Acute Bronchitis**: An inflammation of the airways in the lungs that often follows a blood tinged cough and can present with a sore throat and fever.\n\n3. **Pulmonary Embolism**: A condition where one or more arteries in the lungs become blocked by a blood clot, causing symptoms like chest pain and shortness of breath.\n\n4. **Congestive Heart Failure**: Where the heart is unable to pump blood effectively, which might cause fluid buildup in the lungs, leading to coughing and night sweats.\n\nGiven these possibilities, and considering that your symptoms worsen at night, it would be prudent to seek an in-person evaluation promptly to carry out the necessary diagnostic tests for a more definitive diagnosis. If you have any other questions or need further clarification, feel free to ask."", ""Patient: I understand. I've been experiencing a lot of trouble with my breathing and the chest pain is quite uncomfortable. The sweating and sore throat have also been persistent. I'm not familiar with these conditions so I would appreciate guidance on what to do next. I do not have more information."", ""Diagnosis: ['Pneumonia', 'Pulmonary Embolism', 'Congestive Heart Failure', 'Acute Bronchitis']"", ""Doctor: Based on the symptoms you've shared, the following are possible conditions you might be experiencing:\n\n1. **Pneumonia**: This is an infection of the lungs that can cause fever, chills, chest pain, and coughing up colored mucus.\n\n2. **Pulmonary Embolism**: A condition characterized by a blockage in one or more arteries in the lungs, leading to chest pain and shortness of breath.\n\n3. **Congestive Heart Failure**: This occurs when the heart is unable to pump blood effectively, potentially causing fluid buildup in the lungs, which results in coughing and night sweats.\n\n4. **Acute Bronchitis**: An inflammation of the airways in the lungs that can lead to a persistent cough, sore throat, and fever.\n\nIt's important to seek medical evaluation as soon as possible for an accurate diagnosis and appropriate treatment plan. Make sure to discuss all your symptoms with a healthcare professional who can conduct necessary tests and guide you through the next steps. Take care.""]"
