,disease,diagnosis lists,manual_label_1,manual label,score,conversations
9,cervical spondylosis,"['Cervical Spondylosis', 'Herniated Cervical Disc', 'Cervical Myelopathy', 'Multiple Sclerosis']",1,1,5,"[""Patient: I've been having trouble with my neck. It's been hurting, and I've been having trouble staying balanced. I've also been having numbness in my arms and legs."", ""Diagnosis: ['Cervical Spondylosis', 'Herniated Cervical Disc', 'Cervical Myelopathy', 'Multiple Sclerosis']"", 'Doctor: Thank you for sharing your symptoms with me. I would like to ask a few more questions to better understand your condition:\n\n1. How long have you been experiencing these symptoms?\n2. Have you noticed any specific activities or movements that worsen or improve your symptoms?\n3. Do you have any history of neck injuries or trauma?\n4. Are you currently taking any medications or have any other medical conditions that I should be aware of?\n\nThese questions will help provide a clearer picture of what might be causing your symptoms. Please let me know if you have any other concerns as well.', ""Patient: 1. I've been experiencing these symptoms for a few weeks now.\n2. Certain movements, like turning my head quickly, seem to make the pain worse.\n3. I don't have any history of neck injuries or trauma.\n4. I do not have more information."", ""Diagnosis: ['Cervical Spondylosis', 'Herniated Cervical Disc', 'Cervical Myelopathy', 'Multiple Sclerosis']"", ""Doctor: Based on the symptoms you're experiencing and the information you have provided, some possible conditions could include:\n\n1. Cervical Spondylosis\n2. Herniated Cervical Disc\n3. Cervical Myelopathy\n4. Multiple Sclerosis\n\nWould you like to provide any additional information or have any other symptoms or concerns that you haven't mentioned yet? This can help ensure we are considering all the possibilities."", 'Patient: I do not have more information.', ""Diagnosis: ['Cervical Spondylosis', 'Herniated Cervical Disc', 'Cervical Myelopathy', 'Multiple Sclerosis']"", 'Doctor: Based on the symptoms and information you have shared, here are four possible conditions that could be causing your symptoms:\n\n1. **Cervical Spondylosis**: This involves age-related changes to the bones, discs, and joints of the neck.\n\n2. **Herniated Cervical Disc**: This occurs when a disc in the neck slips out of place and compresses nearby nerves.\n\n3. **Cervical Myelopathy**: This refers to compression of the spinal cord in the neck, which can cause issues with balance and numbness.\n\n4. **Multiple Sclerosis**: This is a condition that affects the brain and spinal cord, potentially causing a range of symptoms including numbness.\n\nI recommend consulting a medical professional for a thorough evaluation and diagnosis. They can provide appropriate tests and treatment options based on a complete assessment of your condition.']"
10,chicken pox,"['Chickenpox', 'Rubella', 'Measles', 'Scarlet Fever']",1,1,5,"[""Patient: I've had a high fever for the past few days, and I'm not sure what's causing it. I also noticed rashes on my skin, and it's really hard for me to resist scratching them."", ""Diagnosis: ['Measles', 'Rubella', 'Chickenpox', 'Scarlet Fever']"", ""Doctor: I'm sorry to hear you're going through this. Let's try to get to the bottom of what's causing your symptoms. Can you tell me more about the rash? For instance, where on your body did the rash start, and has it spread to other areas? Do you have any other symptoms like a sore throat, cough, or conjunctivitis? Also, have you recently been in contact with anyone who had similar symptoms? Lastly, it would be helpful to know your medical history and if you're currently using any medications."", ""Patient: The rash first appeared on my chest and back, but it has now spread to other areas of my body as well. Besides that, I do not have symptoms like a sore throat, cough, or conjunctivitis. Regarding contact with others, I don't know if I've been in contact with anyone who had similar symptoms. As for my medical history, I do not have more information, and I'm not currently using any medications."", ""Diagnosis: ['Measles', 'Rubella', 'Chickenpox', 'Scarlet Fever']"", ""Doctor: Thank you for sharing this additional information with me. Since I'm looking to gather more details to understand your condition better, could you please let me know if you've noticed any other symptoms like joint pain, swollen lymph nodes, or fatigue? Also, have you recently traveled anywhere or spent time in crowded places where you might have been exposed to illnesses? Let's try to see if we can identify any other possible signs that might help us narrow down the cause of these symptoms."", 'Patient: I do feel quite fatigued lately. As for joint pain or swollen lymph nodes, I haven’t noticed anything specific. I haven’t traveled recently, but I did spend some time in a crowded area a week ago.', ""Diagnosis: ['Measles', 'Rubella', 'Chickenpox', 'Scarlet Fever']"", ""Doctor: Thank you for providing more details. Based on the symptoms you've described, here are a few more targeted questions to help us narrow down possible causes for your fever and rash:\n\n1. When did the fever start in relation to the rash? Did one occur before the other?\n2. Have you noticed any changes in the appearance of the rash, like blisters or changes in texture or color?\n3. Are any of your family members experiencing similar symptoms, or do you know if there's been an outbreak of any illnesses in your community recently?\n4. Have you received vaccinations for illnesses like measles, rubella, or chickenpox in the past?\n\nYour answers will help us pinpoint the cause of your symptoms. If you have no further questions, I can summarize the possible illnesses we've discussed."", 'Patient: 1. The fever started a few days before I noticed the rash.\n2. Yes, the rash has developed into blisters.\n3. I do not know.\n4. I do not know.', ""Diagnosis: ['Chickenpox', 'Measles', 'Scarlet Fever', 'Rubella']"", 'Doctor: Thank you for your responses. I’d like to gather a bit more information to help pinpoint the cause of your symptoms:\n\n1. Have the blisters begun to scab over, and are they causing any discomfort or itching?\n2. Have you noticed any additional symptoms such as nausea, headache, or a runny nose?\n3. Have you been in contact with a healthcare professional, and if so, what did they advise?\n4. Are there any known allergies or other health issues you have experienced in the past that might be relevant?\n\nYour answers will help us understand your condition better. Let me know if you have any further questions in the meantime.', ""Patient: 1. The blisters are itchy, and it's hard for me not to scratch them. I am not sure if they have started to scab over.\n2. I have a headache, but no nausea or runny nose.\n3. I do not know.\n4. I do not have more information."", ""Diagnosis: ['Chickenpox', 'Measles', 'Scarlet Fever', 'Rubella']"", ""Doctor: Thank you for providing this information. To help further evaluate your condition, I have a few more questions:\n\n1. Have you had Chickenpox before, or do you remember if you were vaccinated for it during childhood?\n2. Do you have access to any antipyretics (medications to reduce fever) or antihistamines (medications to reduce itching) at home, and if so, have you tried using them?\n3. Are there any specific activities or circumstances that seem to worsen your symptoms, like heat or certain types of clothing?\n\nAnswering these questions will help us get a clearer picture of your situation. If you're feeling that your symptoms are severe or worsening, please make sure to reach out to a healthcare professional for an in-person evaluation. Let me know if you have more information to share or if you need further assistance."", 'Patient: 1. I do not know if I had Chickenpox before or received the vaccination in childhood.  \n2. I have taken some medication to reduce fever, but I do not have any antihistamines.  \n3. Heat seems to make the itching worse.', ""Diagnosis: ['Chickenpox', 'Measles', 'Scarlet Fever', 'Rubella']"", ""Doctor: Based on the symptoms you've described, including a rash that has developed into blisters and a fever that started before the rash, along with associated symptoms like itching and headache, here are a few additional questions that might help us further narrow down the possible illnesses:\n\n1. Have you noticed any changes in appetite or experienced any weight loss since your symptoms began?\n2. Are the blisters concentrated in specific areas or spread across your body, and do they seem to cluster together?\n3. Have you experienced any new symptoms since our last conversation, such as abdominal pain or difficulty breathing?\n4. Do you remember any specific environmental changes or exposures, like new skincare products or changes in diet, that occurred around the time your symptoms started?\n\nYour responses will be helpful in continuing to assess your condition. If you have no further questions, I can help summarize the possible illnesses we've discussed."", 'Patient: 1. I have not noticed any changes in appetite or experienced any weight loss.\n2. The blisters seem to be spread across my body and they do cluster together.\n3. I have not experienced any new symptoms like abdominal pain or difficulty breathing.\n4. I do not remember any specific environmental changes or exposures.', ""Diagnosis: ['Chickenpox', 'Measles', 'Rubella', 'Scarlet Fever']"", ""Doctor: Thank you for clarifying this information. Let's discuss a few further details that could help us better understand your symptoms:\n\n1. How long have the blisters been present, and do they seem to be healing or getting worse?\n2. Are there any sores or ulcers inside your mouth or on your tongue?\n3. Have you noticed any swelling around your eyes or face?\n4. Have you been eating and drinking normally, and are you staying hydrated?\n\nYour responses will help me provide better guidance regarding your symptoms. If you have any other questions or concerns, feel free to ask. If you're ready for a summary of possible illnesses, let me know."", ""Patient: 1. The blisters appeared around the same time as the fever, and they're not healing yet. They seem to be spreading a bit.\n2. I do not have any sores or ulcers inside my mouth or on my tongue.\n3. I do not know.\n4. I've been eating less because I don't feel well, but I'm trying to drink enough water."", ""Diagnosis: ['Chickenpox', 'Rubella', 'Measles', 'Scarlet Fever']"", ""Doctor: Based on the symptoms you've described, including the development of a rash into blisters, fever, and itching, along with other details you provided, it could suggest a few possible conditions. Since the similarity score indicates that there's room for more exploration, let's ask a few more targeted questions:\n\n1. Have you noticed any patterns or times of day when the symptoms seem to worsen or improve?\n2. Are the blisters primarily filled with clear fluid or pus? \n3. Besides fever and headache, have you experienced any chills or sweats?\n4. How long have you had the fever, and have you noticed any fluctuations in its severity?\n\nThese questions can help provide further clarity. Once we have more information, I can summarize the possible conditions for you. Let me know if you have any questions or if there's anything else you'd like to discuss."", ""Patient: 1. I haven't noticed any specific pattern or time of day when the symptoms get better or worse.\n2. The blisters seem to be filled with clear fluid.\n3. Yes, I've experienced some chills along with the fever.\n4. I've had the fever for the past few days, maybe three or four, and it seems to come and go but hasn't gone away entirely."", ""Diagnosis: ['Chickenpox', 'Rubella', 'Measles', 'Scarlet Fever']"", ""Doctor: Thank you for sharing all this information. Given that the similarity score allows for further exploration, let's continue with some additional questions to better assess your symptoms:\n\n1. Are there any regions of your body where the rash or blisters are more concentrated, such as on your trunk, limbs, or face?\n2. Have any of the blisters ruptured or left any marks or scars?\n3. Have you experienced any swelling in your joints or noticed any joint pain since the symptoms began?\n4. Have you experienced any sensitivity to light or visual disturbances?\n\nYour responses will help refine our understanding of your situation. Please let me know if there's any other information you'd like to discuss."", ""Patient: 1. Yes, the rashes and blisters are more concentrated on my trunk.\n2. Some of the blisters have ruptured, but I haven't noticed any marks or scars yet.\n3. I do not have any swelling in my joints or joint pain.\n4. I do not have sensitivity to light or visual disturbances."", ""Diagnosis: ['Chickenpox', 'Measles', 'Rubella', 'Scarlet Fever']"", ""Doctor: Thank you for sharing that information. Based on your symptoms, which include a fever, itchy rash that has developed into blisters, and chills, the possibilities we've explored could fit the following conditions:\n\n1. **Chickenpox**: Known for a blister-like rash, this is a common childhood disease but can occur in adults. The rash often starts on the trunk and can spread, with accompanying fever and itching.\n\n2. **Measles**: This infection often presents with a high fever, cough, and conjunctivitis followed by a rash, but the absence of specific symptoms like a sore throat and conjunctivitis lessens this likelihood.\n\n3. **Rubella**: Typically presents with a rash and fever, but blisters aren't common. Joint pain occurs more in adults with rubella.\n\n4. **Scarlet Fever**: Characterized by a rash that feels like sandpaper and usually follows a sore throat or fever, it does not typically involve blisters or clear fluid.\n\nIf you're comfortable, please let me know if there is any more information you wish to share or if you have additional questions. If not, I recommend consulting a healthcare professional, as they can perform an examination and suggest appropriate tests for an accurate diagnosis."", 'Patient: no more information', ""Diagnosis: ['Chickenpox', 'Rubella', 'Measles', 'Scarlet Fever']"", ""Doctor: Based on the symptoms you've described—fever, itchy rash that has developed into blisters, and chills—here are the four possible illnesses we have discussed:\n\n1. **Chickenpox**: This is characterized by an itchy, blister-like rash, primarily concentrated on the trunk, and often accompanied by fever and chills.\n\n2. **Rubella**: Typically involves a rash and fever, but isn't usually associated with blisters. It's more common for joint pain to be present in adults with rubella.\n\n3. **Measles**: Often manifests with a high fever followed by a rash, but typically also includes symptoms like a cough and conjunctivitis, which you have not reported.\n\n4. **Scarlet Fever**: Known for a rash that feels like sandpaper, generally following a strep throat or fever. It usually doesn't involve blisters with clear fluid.\n\nIt's important to reach out to a healthcare professional for a more precise diagnosis and treatment, as they can conduct a thorough examination and recommend necessary tests. If your symptoms worsen, please seek urgent medical attention.""]"
11,chicken pox,"['Viral Exanthem', 'Petechiae', 'Scarlet Fever', 'Mononucleosis']",1,1,5,"[""Patient: Hello, doctor. I've noticed small red spots all over my body that I can't explain. It's worrying me. I also feel extremely tired and experience a mild fever every night."", ""Diagnosis: ['Viral Exanthem', 'Petechiae', 'Scarlet Fever', 'Mononucleosis']"", ""Doctor: Thank you for reaching out. To better understand your symptoms and provide more accurate advice, could you please provide a bit more information?\n\n1. When did you first notice these symptoms?\n2. Have you experienced any recent colds, infections, or been around anyone who has been sick?\n3. Are you experiencing any other symptoms such as sore throat, swollen lymph nodes, or joint pain?\n4. Could you tell me if you're currently taking any medications, supplements, or have any chronic health conditions?\n5. Have you had any recent changes in your daily routine, diet, or stress levels?\n\nYour responses will help me narrow down the possible causes of your symptoms."", 'Patient: 1. I first noticed these symptoms a few days ago.\n2. I have not been around anyone sick, but I do not know for sure about recent colds or infections.\n3. I do not know.\n4. I am not taking any medications or supplements, and I do not have any chronic health conditions.\n5. I do not know.\n\nI do not have more information.', ""Diagnosis: ['Viral Exanthem', 'Petechiae', 'Scarlet Fever', 'Mononucleosis']"", 'Doctor: Thank you for providing more information. Based on what you\'ve told me, here are some possible conditions that might be causing your symptoms:\n\n1. **Viral Exanthem**: This is a widespread rash caused by a viral infection, which can also lead to fever and fatigue.\n\n2. **Petechiae**: These are tiny red spots that appear on the skin, often caused by bleeding under the skin. It\'s important to monitor if they turn into any other lesions or if new symptoms develop.\n\n3. **Scarlet Fever**: An illness that can develop in people with strep throat, characterized by a rash and fever, among other symptoms.\n\n4. **Mononucleosis**: Often known as ""mono"" or the ""kissing disease,"" this infection can lead to fatigue, fever, sore throat, and swollen lymph glands.\n\nWould you like to provide any more information or ask additional questions about these conditions?', 'Patient: I do not have more information.', ""Diagnosis: ['Viral Exanthem', 'Petechiae', 'Scarlet Fever', 'Mononucleosis']"", 'Doctor: Based on the information you\'ve shared, here are four possible conditions that might be related to your symptoms:\n\n1. **Viral Exanthem**: This is a rash caused by a viral infection, and it can also be accompanied by fever and fatigue.\n\n2. **Petechiae**: Small red spots on the skin caused by bleeding underneath. It\'s important to keep an eye on these spots for any changes.\n\n3. **Scarlet Fever**: Associated with a strep throat infection, characterized by a red rash and fever among other symptoms.\n\n4. **Mononucleosis**: Known as ""mono,"" it includes symptoms like fatigue, fever, sore throat, and swollen lymph nodes.\n\nI strongly advise consulting a healthcare professional for a proper diagnosis and treatment plan. They will be able to conduct a physical examination and may perform tests to determine the exact cause of your symptoms. Take care.']"
12,common cold,"['COVID-19', 'Influenza', 'Upper Respiratory Infection', 'Sinusitis']",0,1,4,"[""Patient: I feel weak and my lymph nodes are swollen. My eyes burn and my throat hurts. My sinuses are congested, and my nose is stuffy. I can't smell anything and my chest hurts."", ""Diagnosis: ['Upper Respiratory Infection', 'Influenza', 'COVID-19', 'Sinusitis']"", ""Doctor: I'm sorry to hear you're experiencing these symptoms. Let's ask a few more questions to better understand your condition:\n\n1. How long have you been experiencing these symptoms?\n2. Have you had a fever or chills?\n3. Are you experiencing any shortness of breath or difficulty breathing?\n4. Do you have any allergies or a history of similar symptoms?\n5. Are you currently taking any medications or have you recently started any new medications?\n\nYour answers will help in assessing your condition more accurately."", ""Patient: 1. It's been a few days now.\n2. I do not know.\n3. I do not know.\n4. I do not know.\n5. I do not know."", ""Diagnosis: ['COVID-19', 'Influenza', 'Upper Respiratory Infection', 'Sinusitis']"", ""Doctor: Thank you for sharing more information. To better understand what you might be experiencing, I have a few more questions:\n\n1. Have you noticed any changes in taste alongside the loss of smell?\n2. Are you experiencing any fatigue, body aches, or headache?\n3. Have you been in contact with anyone who has been sick recently?\n4. Do you have a history of smoking, and if so, how frequently do you smoke?\n5. Are there any other symptoms or changes in your health you've noticed?\n\nProviding this information will help in further assessing your condition. If there's any detail you're unsure about, that's okay too."", 'Patient: 1. I do not know.\n2. I feel weak.\n3. I do not know.\n4. I do not know.\n5. I do not have more information.', ""Diagnosis: ['COVID-19', 'Influenza', 'Upper Respiratory Infection', 'Sinusitis']"", ""Doctor: Based on the symptoms you've described and the information provided, the possible illnesses you might be experiencing include:\n\n1. COVID-19\n2. Influenza\n3. Upper Respiratory Infection\n4. Sinusitis\n\nI strongly recommend consulting a healthcare professional for a thorough examination and accurate diagnosis. Take care and seek immediate medical attention if your symptoms worsen.""]"
